{
  "batch_id": "batch-20260728-000001",
  "source_topic": "pubg.v1.player-stat.raw",
  "kafka_partition": 0,
  "first_offset": 0,
  "last_offset": 4999,
  "record_count": 5000,
  "valid_record_count": 4920,
  "invalid_record_count": 80,
  "duplicate_record_count": 0,
  "data_object": "bronze/player-stat/partition=0/offset=0-4999/batch.parquet",
  "checksum": "e3b0c44298fc1c149afbf4c8996fb92427ae41e4649b934ca495991b7852b855",
  "status": "completed",
  "processed_at": "2026-07-28T01:15:00Z"
}
